{
  "$schema": "./cutover-gates.schema.json",
  "schemaVersion": 1,
  "repository": "hyperlapse122/dotfiles",
  "defaultBranch": "main",
  "protectedEnvironment": "device-evidence",
  "attestation": {
    "trustRoot": "github-sigstore",
    "issuer": "https://token.actions.githubusercontent.com",
    "signerWorkflows": {
      ".github/workflows/device-smoke.yml": {
        "defaultBranchSha": "aaaaaaaaaaaaaaaaaaaaaaaaaaaaaaaaaaaaaaaa"
      }
    }
  },
  "trustedCollectors": {
    ".ci/collect-device-evidence.sh": "1111111111111111111111111111111111111111111111111111111111111111",
    ".ci/collect-device-evidence.ps1": "2222222222222222222222222222222222222222222222222222222222222222"
  },
  "trustedEvaluators": {
    ".ci/evaluate-cutover-gates.mjs": "4444444444444444444444444444444444444444444444444444444444444444",
    ".ci/validate-device-evidence.mjs": "5555555555555555555555555555555555555555555555555555555555555555"
  },
  "devices": [
    {
      "id": "fedora-arm64-01",
      "os": "fedora",
      "arch": "arm64",
      "runnerClass": "self-hosted",
      "runnerLabels": ["self-hosted", "linux", "arm64", "fedora-arm64-01"],
      "status": "active"
    },
    {
      "id": "windows-arm64-01",
      "os": "windows",
      "arch": "arm64",
      "runnerClass": "self-hosted",
      "runnerLabels": ["self-hosted", "windows", "arm64", "windows-arm64-01"],
      "status": "active"
    },
    {
      "id": "macos-arm64-01",
      "os": "macos",
      "arch": "arm64",
      "runnerClass": "self-hosted",
      "runnerLabels": ["self-hosted", "macos", "arm64", "macos-arm64-01"],
      "status": "active"
    },
    {
      "id": "fedora-arm64-00",
      "os": "fedora",
      "arch": "arm64",
      "runnerClass": "self-hosted",
      "runnerLabels": ["self-hosted", "linux", "arm64", "fedora-arm64-00"],
      "status": "revoked"
    },
    {
      "id": "ubuntu-24.04",
      "os": "fedora",
      "arch": "x64",
      "runnerClass": "github-hosted",
      "runnerLabels": ["ubuntu-24.04"],
      "status": "active"
    },
    {
      "id": "windows-2025",
      "os": "windows",
      "arch": "x64",
      "runnerClass": "github-hosted",
      "runnerLabels": ["windows-2025"],
      "status": "active"
    },
    {
      "id": "macos-26",
      "os": "macos",
      "arch": "arm64",
      "runnerClass": "github-hosted",
      "runnerLabels": ["macos-26"],
      "status": "active"
    }
  ],
  "gates": {
    "G0": {
      "summary": "Fixture G0 gate.",
      "status": "closed",
      "reason": "fixture state; candidate CI recomputes",
      "candidateCommit": "0123456789abcdef0123456789abcdef01234567",
      "supportSnapshot": "b2ab3e5071c15188a2ed2c7692b05de554f88525113696dca4fa8d16eadf33c9",
      "evidence": [],
      "mandatoryLegs": [
        {
          "id": "fedora-arm64-required-applications",
          "subject": { "os": "fedora", "arch": "arm64" },
          "claims": [
            "chrome-native-arm64-available",
            "cider-native-arm64-available",
            "edge-native-arm64-available",
            "onepassword-native-arm64-available"
          ]
        }
      ]
    },
    "G1a": {
      "summary": "Fixture G1a gate.",
      "status": "closed",
      "reason": "fixture state; candidate CI recomputes",
      "candidateCommit": "0123456789abcdef0123456789abcdef01234567",
      "supportSnapshot": "b2ab3e5071c15188a2ed2c7692b05de554f88525113696dca4fa8d16eadf33c9",
      "evidence": [],
      "mandatoryLegs": [
        {
          "id": "wezterm-stable-channel-fedora",
          "subject": { "os": "fedora" },
          "claims": [
            "wezterm-stable-release-published",
            "wezterm-kitty-unicode-placeholders-in-stable",
            "wezterm-upstream-stable-rpm-for-current-fedora"
          ]
        },
        {
          "id": "wezterm-stable-channel-windows",
          "subject": { "os": "windows" },
          "claims": [
            "wezterm-stable-release-published",
            "wezterm-kitty-unicode-placeholders-in-stable",
            "wezterm-stable-winget-package"
          ]
        },
        {
          "id": "wezterm-stable-channel-macos",
          "subject": { "os": "macos" },
          "claims": [
            "wezterm-stable-release-published",
            "wezterm-kitty-unicode-placeholders-in-stable",
            "wezterm-stable-homebrew-cask"
          ]
        }
      ]
    },
    "G1b": {
      "summary": "Fixture G1b gate.",
      "status": "closed",
      "reason": "fixture state; candidate CI recomputes",
      "candidateCommit": "0123456789abcdef0123456789abcdef01234567",
      "supportSnapshot": "b2ab3e5071c15188a2ed2c7692b05de554f88525113696dca4fa8d16eadf33c9",
      "evidence": [],
      "mandatoryLegs": [
        {
          "id": "managed-wezterm-fedora",
          "subject": { "os": "fedora", "runnerClass": "self-hosted" },
          "claims": [
            "inline-image-renders-in-tmux",
            "inline-image-survives-scroll",
            "inline-image-survives-redraw",
            "inline-image-survives-resize",
            "inline-image-survives-split"
          ]
        },
        {
          "id": "managed-wezterm-windows",
          "subject": { "os": "windows", "runnerClass": "self-hosted" },
          "claims": [
            "inline-image-renders-in-tmux",
            "inline-image-survives-scroll",
            "inline-image-survives-redraw",
            "inline-image-survives-resize",
            "inline-image-survives-split",
            "inline-image-over-ssh-to-fedora-vm"
          ]
        },
        {
          "id": "managed-wezterm-macos",
          "subject": { "os": "macos" },
          "claims": [
            "inline-image-renders-in-tmux",
            "inline-image-survives-scroll",
            "inline-image-survives-redraw",
            "inline-image-survives-resize",
            "inline-image-survives-split"
          ]
        }
      ]
    }
  }
}
